unique_id_number,program_code,language,program_name,program_acronym,page_type,program_category,government_agency,population_served,age_group,plain_language_program_name,program_description,brief_excerpt,heads_up,plain_language_eligibility,how_to_apply_summary,how_to_apply_or_enroll_online,apply_online_call_to_action,url_of_online_application,how_to_apply_or_enroll_by_mail,apply_by_mail_call_to_action,url_of_pdf_application_forms,how_to_apply_or_enroll_in_person,apply_in_person_call_to_action,office_locations_url,how_to_apply_or_enroll_by_phone,required_documents_summary,get_help_summary,get_help_in_person,get_help_online,get_help_by_email,get_help_by_calling_other_than_311,get_help_by_calling_311,updated_at
P023en,S2R023,English,Summer Meals,NULL,Program,Food,NYC Department of Education,"All New Yorkers, regardless of immigration status,Families with children,Students","Everyone,Baby,Toddler,Pre-Schooler,Grade-Schooler,Pre-Teen,Teen",Free summer meals for everyone 18 and under,"<p>The Free Summer Meals program provides free breakfast and lunch at schools, parks, pools, libraries, and food trucks in all five boroughs. <a href=""https://www.opt-osfns.org/schoolfoodny/meals/default.aspx""  target=""_blank"" rel=""noopener noreferrer"">Find a free breakfast and lunch location near you</a>.</p>","<p>Get free breakfast or lunch at schools, community pool centers, parks, and food trucks near you during the summer.</p>","<ul><li>Summer Meals will be available from <strong>Thursday, June 27, 2024  Friday, August 30, 2024. </strong></li><li>All dates, times, locations and menus are subject to change.<br/></li><li><strong>Breakfast Service Time</strong>: 8:00am - 9:15am</li><li><strong>Lunch Service Time</strong>: 11:00am - 1:15pm</li><li>There is <em>no service</em> on Thursday, July 4, 2024 (4th of July)</li><li>There is service Friday, July 5, 2024 (Day after 4th of July)</li></ul>",<p>Summer Meals is available to anyone age 18 or younger.</p>,NULL,NULL,NULL,NULL,NULL,NULL,NULL,NULL,NULL,NULL,NULL,NULL,"<p>For a full list of dates, times and locations, visit: <a href=""https://www.schools.nyc.gov/school-life/food/summer-meals""  target=""_blank"" rel=""noopener noreferrer"">schools.nyc.gov/SummerMeals </a></p>",NULL,"<p><strong>Learn more</strong></p><p>For a full list of dates, times and locations, visit: <a href=""schools.nyc.gov/SummerMeals""  target=""_blank"" rel=""noopener noreferrer"">schools.nyc.gov/SummerMeals </a></p>",NULL,NULL,"<p><strong>Call 311</strong></p><p>Ask about ""Summer Meals"".</p>",10/12/2024
P024en,S2R024,English,NYCHA Resident Economic Empowerment and Sustainability,REES,Service,Work,NYC Housing Authority (NYCHA),NYCHA residents,"Caregiver,Young Adult",Financial growth training for NYCHA residents,"<p>REES helps NYCHA residents improve their financial futures through hiring events, job training, financial literacy education, and programs on starting a business.</p>","<p>Job, finance, and business training programs for public housing residents.</p>","<ul><li>REES partners can help in many ways. Program areas are: <ul><li><strong>Adult education and training </strong> adult basic education (ABE) classes, pre-High School Equivalency (Pre-HSE) programs, and English language learning programs.</li><li><strong>Financial empowerment </strong> services to help you reach financial stability. </li><li><strong>Employment and career advancement </strong> support to help you find a job.</li><li><strong>resident business development </strong> support to help you start a business.</li></ul></li><li>REES can also help qualified residents access <a href=""http://opportunitynycha.org/about-financial-empowerment/rent-incentives/""  target=""_blank"" rel=""noopener noreferrer"">Earned Income Disallowance (EID)</a>, which can delay rent increases if your income goes up.</li></ul>","<p>Anyone who lives in NYCHA housing is eligible for REES. </p><p>However, the services that REES connects you to have different eligibility rules. The eligibility criteria for each program is on the <a href=""http://opportunitynycha.org/programs-near-me/""  target=""_blank"" rel=""noopener noreferrer"">Opportunity NYCHA site</a>.</p>","<p>Learn more by attending a virtual REES information session.</p><ul><li><a href=""http://opportunitynycha.org/events/""  target=""_blank"" rel=""noopener noreferrer"">RSVP online for the next REES information session</a> or call the REES hotline at <a href=""tel:718-289-8100""  target=""_blank"" rel=""noopener noreferrer"">718-289-8100</a>.</li></ul><p>To connect to REES services, contact a provider.</p><ul><li><a href=""http://opportunitynycha.org/programs-near-me/""  target=""_blank"" rel=""noopener noreferrer"">Find contact information</a> for a provider near you.</li></ul>","<p>Learn more by attending a virtual REES information session.</p><ul><li><a href=""http://opportunitynycha.org/events/""  target=""_blank"" rel=""noopener noreferrer"">RSVP online for the next REES information session</a> or call the REES hotline at <a href=""tel:718-289-8100""  target=""_blank"" rel=""noopener noreferrer"">718-289-8100</a>.</li></ul><p>To connect to REES services, contact a provider.</p><ul><li><a href=""http://opportunitynycha.org/programs-near-me/""  target=""_blank"" rel=""noopener noreferrer"">Find contact information</a> for a provider near you.</li></ul>",NULL,NULL,NULL,NULL,NULL,NULL,NULL,NULL,NULL,"<p>To apply, you'll need to show proof of who you are. This might include documents like:</p><ul><li>driver's license</li><li>official photo ID</li></ul>","<p><strong>Visit the office</strong></p><p>Visit the REES office at 787 Atlantic Ave, Brooklyn, NY, 11238 to get help in person.</p><p>Update: The REES Office is currently closed for in-person services.</p><p><strong>Visit the website</strong></p><p>Learn more about REES services from the <a href=""http://opportunitynycha.org/""  target=""_blank"" rel=""noopener noreferrer"">Opportunity NYCHA website</a>.</p><p><strong>Call REES</strong></p><p>Call the REES hotline at <a href=""tel:718-289-8100""  target=""_blank"" rel=""noopener noreferrer"">718-289-8100</a> to lean more.</p><p><strong>Call 311</strong></p><p>Ask for REES assistance.</p>","<p><strong>Visit the office</strong></p><p>Visit the REES office at 787 Atlantic Ave, Brooklyn, NY, 11238 to get help in person.</p><p>Update: The REES Office is currently closed for in-person services.</p>","<p><strong>Visit the website</strong></p><p>Learn more about REES services from the <a href=""http://opportunitynycha.org/""  target=""_blank"" rel=""noopener noreferrer"">Opportunity NYCHA website</a>.</p>",NULL,"<p><strong>Call REES</strong></p><p>Call the REES hotline at <a href=""tel:718-289-8100""  target=""_blank"" rel=""noopener noreferrer"">718-289-8100</a> to learn more.</p>",<p><strong>Call 311</strong></p><p>Ask for REES assistance.</p>,05/12/2022
P025en,S2R025,English,Older Adult Employment Program,NULL,Program,Work,NYC Department of the Aging,Older Adults,Caregiver,Job training and placement for older adults,"<p>The Older Adult Employment Program helps adults 55 and older prepare for and find work while paying them. Older adults get trained to use computers, look for work, write resumes, and more. Career counselors are also there to give advice.</p>",<p>Free program offering training and job placement help for older adults 55 and older.</p>,"<ul><li>There are job placements citywide for many kinds of work which include:<ul><li>data processing</li><li>administrative work</li><li>customer service</li><li>security services</li><li>airport services</li><li>home care</li></ul></li><li>Requires proof of identity, income, where you live, and eligibility to work.</li></ul>","<p>To be eligible for the Older Adult Employment Program, you must: </p><ul><li>Be 55 years or older</li><li>Live in the five boroughs</li><li>Be unemployed</li><li>Be willing to learn new skills</li><li>Commit to actively seeking employment</li></ul><p>Your households income must be at or below the amount shown in this chart.</p><table><tr><td><p><strong>Household size</strong></p></td><td><p><strong>Your income (125% or less than the federal poverty level)</strong></p></td></tr><tr><td><p>1</p></td><td><p>$18,825</p></td></tr><tr><td><p>2</p></td><td><p>$25,550</p></td></tr><tr><td><p>3</p></td><td><p>$32,275</p></td></tr><tr><td><p>4</p></td><td><p>$39,000</p></td></tr><tr><td><p>5</p></td><td><p>$45,725</p></td></tr><tr><td><p>6</p></td><td><p>$52,450</p></td></tr><tr><td><p>7</p></td><td><p>$59,175</p></td></tr><tr><td><p>8</p></td><td><p>$65,900</p></td></tr><tr><td><p>For each additional person</p></td><td><p>add $6,725</p></td></tr></table><p><br/></p>","<p>Attend a virtual Information Session, held every Tuesday at 10:00 a.m. over Zoom. <a href=""https://forms.office.com/pages/responsepage.aspx?id=x2_1MoFfIk6pWxXaZlE77y4l3kcMk4hBmUCtPjazFnVUQUI2RFBTOVo1U09FNTY1MTlCNFZOQllXQiQlQCN0PWcu""  target=""_blank"" rel=""noopener noreferrer"">Complete the interest form online</a>.</p><p>Or, you can attend an Information Session in person. Register by calling Aging Connect at 212-Aging-NY at <a href=""tel:212-244-6469""  target=""_blank"" rel=""noopener noreferrer"">212-244-6469</a>.</p>","<p>Attend a virtual Information Session, held every Tuesday at 10:00 a.m. over Zoom. <a href=""https://forms.office.com/pages/responsepage.aspx?id=x2_1MoFfIk6pWxXaZlE77y4l3kcMk4hBmUCtPjazFnVUQUI2RFBTOVo1U09FNTY1MTlCNFZOQllXQiQlQCN0PWcu""  target=""_blank"" rel=""noopener noreferrer"">Complete the interest form online</a>.</p><p>Or, you can attend an Information Session in person. Register by calling Aging Connect at 212-Aging-NY at <a href=""tel:212-244-6469""  target=""_blank"" rel=""noopener noreferrer"">212-244-6469</a>.</p>",NULL,https://forms.office.com/pages/responsepage.aspx?id=x2_1MoFfIk6pWxXaZlE77y4l3kcMk4hBmUCtPjazFnVUQUI2RFBTOVo1U09FNTY1MTlCNFZOQllXQiQlQCN0PWcu,NULL,NULL,NULL,NULL,NULL,NULL,NULL,NULL,"<ul><li>Visit <a href=""http://www1.nyc.gov/site/dfta/services/senior-employment.page""  target=""_blank"" rel=""noopener noreferrer"">NYC Aging's Older Adult Employment website</a> for more information.</li><li>Call <a href=""tel:311""  target=""_blank"" rel=""noopener noreferrer"">311</a> and ask for the Older Adult Employment Program to learn more.</li></ul>",NULL,"<p><strong>Learn more</strong></p><p>Visit <a href=""http://www1.nyc.gov/site/dfta/services/senior-employment.page""  target=""_blank"" rel=""noopener noreferrer"">NYC Aging's Older Adult Employment website</a> for more information.</p>",NULL,"<p><strong>Call</strong></p><p>Call the Older Adult Employment Program at <a href=""tel:212-602-6958"" >212-602-6958</a> to learn more.</p>",<p><strong>Call 311</strong> </p><p>Ask for the Older Adult Employment Program.</p>,07/17/2024
P026en,S2R026,English,Workforce1 Career Centers,WF1CC,Service,Work,NYC Department of Small Business Services (SBS),"All New Yorkers, regardless of immigration status","Caregiver,Young Adult",Free job prep service,<p>Workforce1 Career Centers help New Yorkers prepare for and connect to jobs across NYC's five boroughs.</p>,<p>Service that connects and helps you prepare you for jobs in NYC. </p>,"<ul><li>Services are available for free online and in person. They include: <ul><li>job listings, recruitment events, and job search resources</li><li>rsum and interview workshops</li><li>job training to get skills in growing fields</li></ul></li></ul>",<p>You can get services from a Workforce1 Career Center if you: </p><ul><li>live in New York City</li><li>are 18 or older</li><li>are legally authorized to work in the U.S. </li></ul>,"<p><a href=""https://www1.nyc.gov/site/sbs/careers/find-a-job.page""  target=""_blank"" rel=""noopener noreferrer"">Register online</a> or in-person at a<a href=""https://maps.nyc.gov/sbs/""  target=""_blank"" rel=""noopener noreferrer"">Workforce1 Career Center</a>.</p>","<p>Register by filling out the <a href=""https://www1.nyc.gov/site/sbs/careers/find-a-job.page""  target=""_blank"" rel=""noopener noreferrer"">online form</a>.</p>",Register online,https://www1.nyc.gov/site/sbs/careers/find-a-job.page,NULL,NULL,NULL,"<p>Register in person at a <a href=""https://maps.nyc.gov/sbs""  target=""_blank"" rel=""noopener noreferrer"">Workforce1 Center</a> near you.</p>",Find a center,https://maps.nyc.gov/sbs,NULL,<p>You will need an ID like a driver's license or IDNYC card.</p>,"<ul><li>If you have questions, contact Workforce1 on their <a href=""https://www1.nyc.gov/site/sbs/careers/contact.page""  target=""_blank"" rel=""noopener noreferrer"">online form</a>.</li><li>Call Telephone Relay System at <a href=""tel:800-662-1220"" >800-662-1220</a> if youre hearing or speech-impaired.<br/></li></ul>",NULL,"<p><strong>Contact Workforce1 online</strong></p><p>If you have questions, contact Workforce1 on their <a href=""https://www1.nyc.gov/site/sbs/careers/contact.page""  target=""_blank"" rel=""noopener noreferrer"">online form</a>.</p>",NULL,"<p><strong>Call for Workforce1 if youre hearing or speech-impaired</strong></p><p>Call NYC Telephone Relay System at <a href=""tel:800-662-1220""  target=""_blank"" rel=""noopener noreferrer"">800-662-1220</a>.</p>","<p><strong>Call 311</strong></p><p>Ask for ""Workforce1"" if you need help finding a program.</p>",08/21/2024
P027en,S2R027,English,Commodity Supplemental Food Program,CSFP,Program,Food,NYS Department of Health (NYS DOH),Older Adults,Caregiver,Healthy food packages for older adults,<p>Adults ages 60 or older are eligible for monthly food packages if they earn below a certain income.</p>,<p>Food packages for low-income adults age 60 and older.</p>,"<ul><li>Once every month, you or someone representing you can pick up your food package at a CSFP distribution site.<ul><li>Packages can include cheese, milk, rice, pasta, cereal, canned vegetables, fruits, chicken or fish, and more.</li></ul></li><li>During summer, you can also get additional benefits to buy fresh fruits and vegetables at farmers markets.</li><li>CSFP nutritionists also give cooking demonstrations and nutrition lessons.</li><li>Additionally, CSFP can connect you to health care and social service agencies.</li><li>You can get CSFP even if you are receiving <a href=""https://access.nyc.gov/programs/supplemental-nutrition-assistance-program-snap/""  target=""_blank"" rel=""noopener noreferrer"">SNAP (food stamp) benefits</a>.</li></ul>","<p>To be eligible, you should be able to answer <strong>yes</strong> to these questions:</p><ol><li>Are you 60 years old or older?</li><li>Are you a New York State resident?<ul><li>You do not need to be a US citizen to receive CSFP benefits.</li></ul></li><li>Is your household's total pre-tax income equal to or less than CSFP income requirements below?</li></ol><table><tr><td><p><strong>Household size</strong></p></td><td><p><strong>Income in a year</strong></p></td></tr><tr><td><p>1</p></td><td><p>$19,578</p></td></tr><tr><td><p>2</p></td><td><p>$26,572</p></td></tr><tr><td><p>3</p></td><td><p>$33,566</p></td></tr><tr><td><p>4</p></td><td><p>$40,560</p></td></tr><tr><td><p>5</p></td><td><p>$47,554</p></td></tr><tr><td><p>6</p></td><td><p>$54,548</p></td></tr><tr><td><p>7</p></td><td><p>$61,542</p></td></tr><tr><td><p>8</p></td><td><p>$68,536</p></td></tr><tr><td><p><strong>For each additional person, add:</strong></p></td><td><p>$6,994</p></td></tr></table><p><br/></p>","<p><strong>In-person</strong></p><p><a href=""https://www.health.ny.gov/prevention/nutrition/csfp/apply.htm""  target=""_blank"" rel=""noopener noreferrer"">Visit a CSFP site near you</a>. Call ahead to confirm the documents that you will need to bring.</p><p><strong>Apply by phone</strong></p><p>Call a CSFP local agency provider near you for application information.</p><ul><li>Bronx: <a href=""tel:917-982-2564""  target=""_blank"" rel=""noopener noreferrer"">917-982-2564</a></li><li>Brooklyn: <a href=""tel:718-498-9208""  target=""_blank"" rel=""noopener noreferrer"">718-498-9208</a></li><li>Manhattan: <a href=""tel:212-566-7855""  target=""_blank"" rel=""noopener noreferrer"">212-566-7855</a></li><li>Nassau/Suffolk: <a href=""tel:631-873-4775""  target=""_blank"" rel=""noopener noreferrer"">631-873-4775</a></li></ul>",NULL,NULL,NULL,NULL,NULL,NULL,"<p><a href=""https://www.health.ny.gov/prevention/nutrition/csfp/apply.htm""  target=""_blank"" rel=""noopener noreferrer"">Visit a CSFP site near you</a>. Call ahead to confirm the documents that you will need to bring.</p>",Find a site,https://www.health.ny.gov/prevention/nutrition/csfp/apply.htm,"<p>Call a CSFP local agency provider near you for application information.</p><ul><li>Bronx: <a href=""tel:917-982-2564""  target=""_blank"" rel=""noopener noreferrer"">917-982-2564</a></li><li>Brooklyn: <a href=""tel:718-498-9208""  target=""_blank"" rel=""noopener noreferrer"">718-498-9208</a></li><li>Manhattan: <a href=""tel:212-566-7855""  target=""_blank"" rel=""noopener noreferrer"">212-566-7855</a></li><li>Nassau/Suffolk: <a href=""tel:631-873-4775""  target=""_blank"" rel=""noopener noreferrer"">631-873-4775</a></li></ul>",NULL,"<ul><li>The <a href=""https://www.health.ny.gov/prevention/nutrition/csfp/""  target=""_blank"" rel=""noopener noreferrer"">NYS Department of Health</a> has more information about CSFP.</li></ul>",NULL,"<p><strong>Visit the website</strong> </p><p>The <a href=""https://www.health.ny.gov/prevention/nutrition/csfp/""  target=""_blank"" rel=""noopener noreferrer"">NYS Department of Health</a> has more information about CSFP.</p>",NULL,NULL,NULL,09/24/2024
P028en,S2R028,English,Learn & Earn,NULL,Program,Work,NYC Department of Youth & Community Development (DYCD),Students,"Teen,Young Adult",College and job prep for juniors and seniors in high school,"<p>Learn & Earn is a year-round program for high school juniors and seniors at risk of dropping out of school. The program provides academic support, college application assistance, work readiness training, service-learning, and leadership activities, as well as a paid six-week summer internship.</p>",<p>Year-round program with college and job prep for high schoolers at risk of dropping out.</p>,<ul><li>There are Learn & Earn programs in each borough. Each program may have different age and eligibility requirements.</li><li>Enroll between September 1st - 30th.</li><li>You need a social security number and must be able to work legally in the U.S.</li></ul>,"<p>You may be eligible if you can answer yes to these questions:</p><ol><li>Are you between 16 - 21 years old?</li><li>Are you an NYC high school junior or senior?</li><li>Do you have a social security number?</li><li>Can you legally work in the US?</li><li>Are you registered for selective service, if you're an eligible male?</li><li>Do you meet <strong>one</strong> of these requirements?<br/><ul><li>You or someone in your household gets cash assistance or SNAP (food stamps)</li><li>You are a homeless or runaway youth</li><li>You are a foster care youth or have aged out of the foster care system</li><li>You are involved in the justice system</li><li>You are pregnant or a parent</li><li>You have a disability. Learn & Earn will look at your own income (not your family's) to see if you are eligible.</li><li>Is your households income at or below the amount shown in this chart?<br/></li></ul></li></ol><table><tr><td><p>Household size</p></td><td><p>Monthly income</p></td><td><p>Yearly income</p></td></tr><tr><td><p>1</p></td><td><p>$1,215</p></td><td><p>$14,580</p></td></tr><tr><td><p>2</p></td><td><p>$1,643</p></td><td><p>$19,720</p></td></tr><tr><td><p>3</p></td><td><p>$2,072</p></td><td><p>$24,860</p></td></tr><tr><td><p>4</p></td><td><p>$2,500</p></td><td><p>$30,000</p></td></tr><tr><td><p>5</p></td><td><p>$2,928</p></td><td><p>$35,140</p></td></tr><tr><td><p>6</p></td><td><p>$3,357</p></td><td><p>$40,280</p></td></tr><tr><td><p>7</p></td><td><p>$3,785</p></td><td><p>$45,420</p></td></tr><tr><td><p>8</p></td><td><p>$4,213</p></td><td><p>$50,560</p></td></tr><tr><td><p>For each additional person</p></td><td><p>add $428</p></td><td><p>add $5,140</p></td></tr></table><p><br/></p>","<ul><li>Call DYCD Community Connect at <a href=""tel:800-246-4646"" >800-246-4646</a> or <a href=""tel:646-343-6800"" >646-343-6800</a> to apply.</li><li>You can also go to the <a href=""https://discoverdycd.dycdconnect.nyc/program-public""  target=""_blank"" rel=""noopener noreferrer"">Discover DYCD website</a>, select jobs & internships, and search for ""Learn & Earn"".</li></ul>","<ol><li>Find a program on <a href=""https://discoverdycd.dycdconnect.nyc/program-public""  target=""_blank"" rel=""noopener noreferrer"">Discover DYCD website</a> by selecting jobs & internships, and searching for ""Learn & Earn"".</li><li>Contact a program near you for more information.</li></ol>",Find a program,https://discoverdycd.dycdconnect.nyc/program-public,NULL,NULL,NULL,NULL,NULL,NULL,"<p>Call DYCD Community Connect at <a href=""tel:800-246-4646""  target=""_blank"" rel=""noopener noreferrer"">800-246-4646</a> or <a href=""tel:646-343-6800""  target=""_blank"" rel=""noopener noreferrer"">646-343-6800</a> to apply.</p>","<p>To apply for Learn & Earn, you will need to prove the following:</p><ul><li>Your identity and date of birth</li><li>Where you live</li><li>Your family's income</li></ul>","<ul><li>Visit the <a href=""https://www1.nyc.gov/site/dycd/services/after-school/in-school-youth-isy.page""  target=""_blank"" rel=""noopener noreferrer"">Learn & Earn page</a> on DYCD's website to learn more.</li></ul>",NULL,"<p><strong>Visit the website</strong></p><p>Visit the <a href=""https://www1.nyc.gov/site/dycd/services/after-school/in-school-youth-isy.page""  target=""_blank"" rel=""noopener noreferrer"">Learn & Earn page</a> on DYCD's website to learn more.</p>",NULL,NULL,<p><strong>Call 311</strong></p><p>Ask for assistance with the Learn & Earn program.</p>,10/10/2024
