unique_id_number,program_code,language,program_name,program_acronym,page_type,program_category,government_agency,population_served,age_group,plain_language_program_name,program_description,brief_excerpt,heads_up,plain_language_eligibility,how_to_apply_summary,how_to_apply_or_enroll_online,apply_online_call_to_action,url_of_online_application,how_to_apply_or_enroll_by_mail,apply_by_mail_call_to_action,url_of_pdf_application_forms,how_to_apply_or_enroll_in_person,apply_in_person_call_to_action,office_locations_url,how_to_apply_or_enroll_by_phone,required_documents_summary,get_help_summary,get_help_in_person,get_help_online,get_help_by_email,get_help_by_calling_other_than_311,get_help_by_calling_311,updated_at
P121en,N/A,English,We Speak NYC,WSNYC,Resource,Education,Mayor's Office of Immigrant Affairs (MOIA),"All New Yorkers, regardless of immigration status","Caregiver,Teen,Young Adult",English conversation and learning program,"<p>We Speak NYC helps English language learners age 16 and above to learn English and access services. The program has online classes, videos, web, and print materials for you to practice at home.</p>",<p>Free classes with materials for you to learn about City services and improve your English.</p>,"<ul><li>We Speak NYC classes help you build and practice conversation skills at community classes in all five boroughs.</li><li>Classes are available for free <a href=""https://wespeaknyc.cityofnewyork.us/wsnyc-online-classes/""  target=""_blank"" rel=""noopener noreferrer"">online</a> and <a href=""https://wespeaknyc.cityofnewyork.us/classes-near-you/""  target=""_blank"" rel=""noopener noreferrer"">in-person</a>.</li><li>Classes and materials are created for intermediate English language learners.</li><li>The <a href=""https://wespeaknyc.cityofnewyork.us/episodes""  target=""_blank"" rel=""noopener noreferrer"">videos</a> and materials tell stories about New Yorkers who have come from all over the world and explain some important services and resources that the City offers.<ul><li>Each video has a script, study guide, and vocabulary practice.</li></ul></li><li>You can also <a href=""https://a002-irm.nyc.gov/EventRegistration/RegForm.aspx?eventGuid=7d6f7829-b867-4acd-b461-e917c9281124""  target=""_blank"" rel=""noopener noreferrer"">volunteer to lead a class</a> or <a href=""https://a002-irm.nyc.gov/EventRegistration/RegForm.aspx?eventGuid=c983e2d5-7d31-412e-ab74-8c30dfe0c351""  target=""_blank"" rel=""noopener noreferrer"">host a class</a> for We Speak NYC.</li></ul>",<p>Anyone is eligible to sign up for an online class. Classes and materials are created for intermediate English language learners ages 16 and above.</p>,"<ul><li><strong>For learners: </strong>Online classes meet once a week and run for 8 weeks. In-person classes vary by location. <a href=""https://wespeaknyc.cityofnewyork.us/classes-near-you/"" >Find a class online or in-person that works for you</a>. <ul><li>You can also start learning English by<strong> </strong><a href=""https://wespeaknyc.cityofnewyork.us/episodes/""  target=""_blank"" rel=""noopener noreferrer"">watching We Speak NYC's videos</a>.</li></ul></li><li><strong>For volunteers</strong>: <a href=""https://a002-irm.nyc.gov/EventRegistration/RegForm.aspx?eventGuid=7d6f7829-b867-4acd-b461-e917c9281124""  target=""_blank"" rel=""noopener noreferrer"">Apply to lead a class</a></li><li><strong>For partners</strong>: <a href=""https://a002-irm.nyc.gov/EventRegistration/RegForm.aspx?eventGuid=c983e2d5-7d31-412e-ab74-8c30dfe0c351""  target=""_blank"" rel=""noopener noreferrer"">Apply to host an in-person class</a></li></ul><p><strong>Enroll by phone</strong></p><ul><li>Call the Mayor's Office of Immigrant Affairs main line <a href=""tel:212-788-7654""  target=""_blank"" rel=""noopener noreferrer"">212-788-7654</a>. You can ask to be connected with WSNYC to find and take a class, volunteer to lead a class, or to become a partner host-site.</li></ul>","<ul><li><strong>For learners: </strong>Online classes meet once a week and run for 8 weeks. In-person classes vary by location. <a href=""https://wespeaknyc.cityofnewyork.us/classes-near-you/"" >Find a class online or in-person that works for you</a>.<ul><li>You can also start learning English by<strong> </strong><a href=""https://wespeaknyc.cityofnewyork.us/episodes/""  target=""_blank"" rel=""noopener noreferrer"">watching We Speak NYC's videos</a>.</li></ul></li><li><strong>For volunteers</strong>: <a href=""https://a002-irm.nyc.gov/EventRegistration/RegForm.aspx?eventGuid=7d6f7829-b867-4acd-b461-e917c9281124""  target=""_blank"" rel=""noopener noreferrer"">Apply to lead a class</a>.</li><li><strong>For partners</strong>: <a href=""https://a002-irm.nyc.gov/EventRegistration/RegForm.aspx?eventGuid=c983e2d5-7d31-412e-ab74-8c30dfe0c351""  target=""_blank"" rel=""noopener noreferrer"">Apply to host an in-person class</a>.</li></ul>",NULL,NULL,NULL,NULL,NULL,"<p>Find a <a href=""https://wespeaknyc.cityofnewyork.us/classes-near-you/""  target=""_blank"" rel=""noopener noreferrer"">class near you</a> and walk in. No sign-up or enrollment required. </p>",NULL,NULL,"<p>Call the Mayor's Office of Immigrant Affairs at <a href=""tel:212-788-7654""  target=""_blank"" rel=""noopener noreferrer"">212-788-7654</a>. You can ask to be connected with WSNYC to find and take a class, to volunteer to lead a class, or to become a partner host-site.</p>",NULL,"<ul><li>Visit the <a href=""https://wespeaknyc.cityofnewyork.us/""  target=""_blank"" rel=""noopener noreferrer"">We Speak NYC website</a> for more information.</li><li>Email <a href=""mailto:wespeaknyc@cityhall.nyc.gov""  target=""_blank"" rel=""noopener noreferrer"">wespeaknyc@cityhall.nyc.gov</a> if you have questions or want to learn more.</li><li>For general comments or questions, fill out <a href=""https://wespeaknyc.cityofnewyork.us/contact-us/""  target=""_blank"" rel=""noopener noreferrer"">MOIA's Contact Us form</a> or call <a href=""tel:212-788-7654"" >212-788-7654</a>.</li></ul>",NULL,"<p><strong>Visit the website</strong></p><p>Visit the <a href=""https://wespeaknyc.cityofnewyork.us/""  target=""_blank"" rel=""noopener noreferrer"">We Speak NYC website</a> for more information.</p>","<p><strong>Email We Speak NYC</strong></p><p>Email <a href=""mailto:wespeaknyc@cityhall.nyc.gov""  target=""_blank"" rel=""noopener noreferrer"">wespeaknyc@cityhall.nyc.gov</a> if you have questions or want to learn more.</p>","<p><strong>Call for We Speak NYC</strong></p><p>For general comments or questions, fill out <a href=""https://wespeaknyc.cityofnewyork.us/contact-us/""  target=""_blank"" rel=""noopener noreferrer"">MOIA's Contact Us form</a> or call <a href=""tel:212-788-7654""  target=""_blank"" rel=""noopener noreferrer"">212-788-7654</a>.</p>",NULL,08/21/2024
P122en,N/A,English,Homebase,NULL,Service,Housing,NYC Human Resources Administration (HRA),"All New Yorkers regardless of legal status,Everyone",Caregiver,Services to help you keep your housing,<p>Homebase can help if you're at risk of becoming homeless. They have locations across New York City's five boroughs and offer a wide range of services to help you if you have a housing crisis.</p>,"<p>If you're at risk of homelessness, Homebase offers support to stay out of shelter and remain stably housed.</p>","<ul><li>Homebase will help you develop a personalized plan to overcome an immediate housing crisis and have more stability with your housing. </li><li>You do <strong>not </strong>have to wait until you are in housing court to seek help from Homebase.</li><li>Homebase can help a wide range of services, including:<ul><li>Services to prevent eviction</li><li>Help getting public benefits</li><li>Emergency rental assistance</li><li>Education and job placement assistance</li><li>Financial counseling and money management</li><li>Help moving</li><li>Short-term financial assistance</li></ul></li></ul>","<p>You may be eligible for Homebase services if you:</p><ul><li>Live in one of the five boroughs of NYC</li><li>May be soon at risk of entering the NYC shelter system</li><li>Want to remain stably housed in your community</li></ul><p>If you think you need Homebase services, contact a local office so they can review your specific situation and offer support. Even if you are not eligible, Homebase can help you find resources that might be helpful.</p>","<ol><li>Find a Homebase location by calling 311 or viewing the <a href=""https://www1.nyc.gov/site/hra/help/homebase-locations.page""  target=""_blank"" rel=""noopener noreferrer"">HomeBase map</a> and searching by your zip code.</li><li>Call to schedule a meeting with a Homebase representative. In person appointments must be scheduled in advance.</li><li>Bring as many of the application documents as you can to your first appointment. Having all the documents is not required to receive help.<ul><li><strong>Note:</strong> If you have children, you do not need to bring them with you. However, you should bring their identification documents.</li></ul></li></ol>",NULL,NULL,NULL,NULL,NULL,NULL,"<ol><li>Find a Homebase location by calling 311 or viewing the <a href=""https://www1.nyc.gov/site/hra/help/homebase-locations.page""  target=""_blank"" rel=""noopener noreferrer"">HomeBase map</a> and searching by your zip code.</li><li>Call to schedule a meeting with a Homebase representative. In person appointments must be scheduled in advance.</li><li>Bring as many of the application documents as you can to your first appointment. Having all the documents is not required to receive help.<ul><li><strong>Note:</strong> If you have children, you do not need to bring them with you. However, you should bring their identification documents.</li></ul></li></ol>",Visit a location,https://www1.nyc.gov/site/hra/help/homebase-locations.page,"<p>Find a Homebase location by calling 311 or viewing the <a href=""https://www1.nyc.gov/site/hra/help/homebase-locations.page""  target=""_blank"" rel=""noopener noreferrer"">HomeBase map</a> and searching by your zip code. Then, call to schedule an appointment.</p>","<p>These are the documents you need to bring on your first appointment. If you don't have all of these documents, Homebase can still assess your case and help.</p><ul><li>ID for all household members 18 years or older</li><li>Proof of income/employment for every working member of the household (recent paystubs dated within 30 days of Homebase appointment)</li><li>If you have an active Cash Assistance (CA) case, bring a CA Budget Letter or Welfare Management System (WMS) printout dated within 30 days</li><li>Unemployment letter</li><li>Supplemental Security Income (SSI) or Social Security Disability (SSD) Award Letter, dated within the last year</li><li>Copy of lease or written rental agreement</li><li>Rental Assistance referral, certificate, voucher, or award letter</li><li>Rent demand, landlord letter, or court documents</li><li>Light, gas, and telephone bill</li></ul>","<ul><li>Visit the <a href=""https://www1.nyc.gov/site/hra/help/homebase.page""  target=""_blank"" rel=""noopener noreferrer"">Homebase website</a> for more information.</li></ul>",NULL,"<p><strong>Visit the website </strong></p><p>Visit the <a href=""https://www1.nyc.gov/site/hra/help/homebase.page""  target=""_blank"" rel=""noopener noreferrer"">Homebase website</a> for more information.</p>",NULL,NULL,"<p><strong>Call 311</strong></p><p>Ask about a Homebase location closest to your address, what to bring, and what you can expect at your meeting.</p>",03/12/2024
P124en,N/A,English,Safe and Sick Leave,NULL,Resource,Work,Department of Consumer and Worker Protection (DCWP),"Families,Immigrants,NYCHA residents,People with disabilities,Pregnant & new parents,Seniors,Students,Veterans,COVID-19 impacted","Caregiver,Young Adult",Employee sick and family leave,"<p>NYC employees have legal rights to paid and unpaid leave, including expanded rights under City and State laws. You can take unpaid and paid leave, depending on your circumstances and the type of employer you work for, to care for yourself or family members impacted by COVID-19. </p>",<p>Paid and unpaid leave for employees who can't work.</p>,"<p><strong> NYC Paid Safe and Sick Leave:</strong></p><ul><li>You can use NYC safe and sick leave for a broad range of health or safety purposes and can use it for yourself, a family member, or someone with whom you have a similarly close relationship</li><li>You accrue 1 hour of sick leave for every 30 hours worked</li><li>There is no waiting period; you can use safe and sick leave as soon as you accrue it and you can decide when to use it<br/></li><li>Your employer must reimburse you if you had to pay for required documentation after three consecutive workdays of leave</li><li>Your paystub (or any document issued each pay period) must list the amounts of accrued and used leave and the total balance of accrued leave<br/></li><li>Immigration status is not a consideration</li></ul><p></p><table><tr><td><p><strong>Number of employees employed by employer</strong></p></td><td><p><strong>Amount of sick leave per calendar year</strong></p></td></tr><tr><td><p>1 to 4 employees where the employer's annual income is less than $1 million</p></td><td><p>Up to 40 hours of unpaid leave</p></td></tr><tr><td><p>1 to 4 employees where the employer's annual income is $1 million or more</p></td><td><p>Up to 40 hours of paid leave</p></td></tr><tr><td><p>1 or more domestic workers employed by household employer</p></td><td><p>Up to 40 hours of paid leave</p></td></tr><tr><td><p>5 or more employees</p></td><td><p>Up to 40 hours of paid leave</p></td></tr><tr><td><p>100 or more employees</p></td><td><p>Up to 56 hours of paid leave</p></td></tr></table><p><strong>NY State Emergency COVID-19 and Paid Sick and Family Leave:</strong></p><ul><li>Provides up to 14 days of additional leave on top of sick leave required by NYC law or that your employer otherwise provides</li><li>Emergency state sick leave only covers leave when you or your child is ordered to quarantine or isolate </li><li>The amount of paid versus unpaid sick leave depends on your employer's size and business income. Learn more from <a href=""https://paidfamilyleave.ny.gov/COVID19""  target=""_blank"" rel=""noopener noreferrer"">NY State Dept of Labor</a>.<br/></li><li>Your employer is required to provide this leave if you qualify and you do not need to apply</li><li>Immigration status is not a consideration</li></ul>","<p><strong>NYC Paid Safe and Sick Leave</strong> covers most employees at any size business or nonprofit in NYC:</p><ul><li>Full and part-time employees, transitional jobs program employees, and employees who live outside of NYC.  </li></ul><p>You are <strong>not</strong> covered if you:</p><ul><li>Are a student in a federal work study program</li><li>Are compensated by qualified scholarship programs</li><li>Are employed by a government agency</li><li>Are a physical therapist, occupational therapist, speech language pathologist, or audiologist licensed by the New York State Department of Education and meet a minimum pay threshold </li><li>Are an independent contractor who does not meet the definition of an employee under New York State Labor Law (go to <a href=""https://www.labor.ny.gov/home/"" ><strong>labor.ny.gov</strong></a> and search Independent Contractors)</li><li>Participate in a Work Experience Program (WEP)</li><li>An employee subject to a collective bargaining agreement that waives the law and has a comparable benefit.<br/></li></ul><p><strong>NY State Emergency COVID-19 and Paid Sick and Family Leave</strong> covers people under mandatory quarantine or isolation orders or whose minor dependent is.</p>","<p><strong>NYC Safe and Sick Leave </strong>is a right your employer mustprovide.</p><ul><li>If your employer is not providing you with leave and you believe you're eligible, <a href=""https://www1.nyc.gov/site/dca/workers/workersrights/file-workplace-complaint.page""  target=""_blank"" rel=""noopener noreferrer"">file a complaint</a> with NYC Department of Consumer and Worker Protection.</li></ul><p><strong>Orders of Quarantine for NY State Emergency COVID-19 and Paid Sick and Family Leave:</strong></p><ul><li>Call the NYC Department of Health at <a href=""tel:8554912667""  target=""_blank"" rel=""noopener noreferrer"">855-491-2667</a> for assistance in obtaining an order of quarantine or isolation</li><li>If you run out of emergency sick leavefrom your employer, you may <a href=""https://paidfamilyleave.ny.gov/COVID19""  target=""_blank"" rel=""noopener noreferrer"">apply for Paid Family Leave benefits on the NY State website</a> under the section that applies to your situation.</li></ul><p>If your employer temporarily closes or goes out of business, or you lose your job or have a reduction in hours, due to COVID-19, you may be eligible for <a href=""https://access.nyc.gov/programs/nys-unemployment-insurance/""  target=""_blank"" rel=""noopener noreferrer"">Unemployment Insurance (UI)</a>.</p><p>If your employer is not providing you with <strong>NYC Safe and Sick Leave</strong> and you believe you're eligible, file a complaint with the City:</p><ul><li><a href=""https://labor.ny.gov/workerprotection/laborstandards/coronavirus-complaints.shtm""  target=""_blank"" rel=""noopener noreferrer"">File online</a> </li><li>Email: <a href=""mailto:OLPS@dca.nyc.gov"" >OLPS@dca.nyc.gov</a>or<a href=""mailto:PSSL@dca.nyc.gov"" >PSSL@dca.nyc.gov</a></li></ul><p>If your employer is not providing you with <strong>NY State Emergency COVID-19 and Paid Sick and Family Leave: </strong>and you believe you're eligible, contact the NYS Department of Labor at <a href=""http://www.paidfamilyleave.ny.gov/covid19""  target=""_blank"" rel=""noopener noreferrer"">paidfamilyleave.ny.gov/covid19</a>.</p><p>For more information or to file a workplace complaint by phone, call 311 and say ""Paid Safe and Sick Leave"" </p><p>If your employer is not providing you with <strong>NY State Emergency COVID-19 and Paid Sick and Family Leave </strong>and you believe you're eligible, contact the NYS Department of Labor at <a href=""tel:844-337-6303""  target=""_blank"" rel=""noopener noreferrer"">844-337-6303</a>.</p>","<p><strong>NYC Safe and Sick Leave </strong>is a right your employer must provide.</p><ul><li>If your employer is not providing you with leave and you believe you're eligible, <a href=""https://www1.nyc.gov/site/dca/workers/workersrights/file-workplace-complaint.page""  target=""_blank"" rel=""noopener noreferrer"">file a complaint</a> with NYC Department of Consumer and Worker Protection.</li></ul><p>Apply for <strong>NY State Emergency COVID-19 and Paid Sick and Family Leave:</strong></p><ul><li>Call the NYC Department of Health at <a href=""tel:8554912667""  target=""_blank"" rel=""noopener noreferrer"">855-491-2667</a> for assistance in obtaining an order of quarantine or isolation.</li><li>If you run out of emergency sick leave from your employer, you may <a href=""https://paidfamilyleave.ny.gov/COVID19"" >apply for Paid Family Leave benefits on the NY State website</a> under the section that applies to your situation.</li></ul><p>If your employer temporarily closes or goes out of business, or you lose your job or have a reduction in hours, due to COVID-19, you may be eligible for <a href=""https://access.nyc.gov/programs/nys-unemployment-insurance/"" >Unemployment Insurance (UI)</a>.</p><p>If your employer is not providing you with <strong>NYC Safe and Sick Leave</strong> and you believe you're eligible, file a complaint with the City:</p><ul><li><a href=""https://labor.ny.gov/workerprotection/laborstandards/coronavirus-complaints.shtm""  target=""_blank"" rel=""noopener noreferrer"">File online</a> </li><li>Email: <a href=""mailto:OLPS@dca.nyc.gov"" >OLPS@dca.nyc.gov</a>or<a href=""mailto:PSSL@dca.nyc.gov"" >PSSL@dca.nyc.gov</a></li></ul><p>If your employer is not providing you with <strong>NY State Emergency COVID-19 and Paid Sick and Family Leave: </strong>and you believe you're eligible, contact the NYS Department of Labor at <a href=""http://www.paidfamilyleave.ny.gov/covid19""  target=""_blank"" rel=""noopener noreferrer"">paidfamilyleave.ny.gov/covid19</a>.</p>",File a complaint,https://www1.nyc.gov/site/dca/workers/workersrights/file-workplace-complaint.page,NULL,NULL,NULL,NULL,NULL,NULL,"<p>For more information or to file a workplace complaint by phone, call 311 and say ""Paid Safe and Sick Leave"" </p><p>If your employer is not providing you with <strong>NY State Emergency COVID-19 and Paid Sick and Family Leave </strong>and you believe you're eligible, contact the NYS Department of Labor at <a href=""tel:844-337-6303""  target=""_blank"" rel=""noopener noreferrer"">844-337-6303</a>.</p>",NULL,"<p><strong>Visit the websites</strong></p><ul><li>Visit <a href=""http://www.nyc.gov/workers""  target=""_blank"" rel=""noopener noreferrer"">nyc.gov/workers</a> to learn more aboutNYC Paid Safe and Sick Leave.</li><li>Visit<strong> </strong><a href=""https://paidfamilyleave.ny.gov/COVID19""  target=""_blank"" rel=""noopener noreferrer"">paidfamilyleave.ny.gov/COVID19</a> to learn more aboutNY State Paid Sick Leave and NY State Emergency COVID-19 Paid Sick and Family Leave.</li></ul><p><strong>Email the Department of Consumer and Worker Protection (DCWP) Division </strong></p><ul><li>Email<strong> </strong><a href=""mailto:olps@dca.nyc.gov""  target=""_blank"" rel=""noopener noreferrer"">OLPS@dca.nyc.gov</a></li></ul><p><strong>Call 311</strong></p><ul><li>Ask for ""Paid Safe and Sick Leave"".</li></ul>",NULL,"<p><strong>Visit the websites</strong></p><p>Visit <a href=""http://www.nyc.gov/workers""  target=""_blank"" rel=""noopener noreferrer"">nyc.gov/workers</a> to learn more aboutNYC Paid Safe and Sick Leave.</p><p>Visit<strong> </strong><a href=""https://paidfamilyleave.ny.gov/COVID19""  target=""_blank"" rel=""noopener noreferrer"">paidfamilyleave.ny.gov/COVID19</a> to learn more aboutNY State Paid Sick Leave and NY State Emergency COVID-19 Paid Sick and Family Leave.</p>","<p><strong>Email the Department of Consumer and Worker Protection (DCWP) Division </strong></p><p>Email<strong> </strong><a href=""mailto:olps@dca.nyc.gov""  target=""_blank"" rel=""noopener noreferrer"">OLPS@dca.nyc.gov</a></p>",NULL,"<p><strong>Call 311</strong></p><p>Ask for ""Paid Safe and Sick Leave"".</p>",05/13/2022
P125en,N/A,English,STEM Matters NYC,NULL,Program,Enrichment,NYC Public Schools,"Children (0-13),NYCHA residents,Students,Youth (10+)","Grade-Schooler,Pre-Teen,Teen",STEM Matters NYC Summer Enrichment Programs,"<p><a href=""https://spep.libguides.com/STEMprograms""  target=""_blank"" rel=""noopener noreferrer"">STEM Matters NYC</a> is offering <strong>free</strong> summer enrichment programs at cultural institutions throughout the five boroughs. </p>",<p>STEM Matters NYC offers many exciting and hands-on STEM programs for K-12 students during spring break and summer. </p>,"<ul><li>Programs are happening on various weeks from <strong>July 10 through August 18, 2024</strong>. </li><li>Available at <a href=""https://spep.libguides.com/STEMprograms/locations""  target=""_blank"" rel=""noopener noreferrer"">various locations</a> throughout NYC</li><li>Students entering grades 1-9 in September 2024 can apply for weeklong camps and will be selected via lottery. </li><li>Students entering grades 10-12 in September 2024 can apply for multi-week programs and will be selected by a review committee. </li><li>All programs are application-based. High school programs require a teacher reference form.<br/></li></ul>",<p>Available to students entering grades 1 through 12 in NYC public and charter schools in September 2024.</p>,"<p><a href=""https://nycdoe.campintouch.com/ui/forms/application/camper/App""  target=""_blank"" rel=""noopener noreferrer"">Apply online</a> by Wednesday, <strong>April 24</strong>.</p><ul><li>Students entering grades 1-9 in September 2024 are selected via lottery.</li><li>Applications for students entering grades 10-12 include a teacher reference form. Students are selected by a review committee. </li><li>For questions, contact <a href=""mailto:STEMMattersNYC@schools.nyc.gov""  target=""_blank"" rel=""noopener noreferrer"">STEMMattersNYC@schools.nyc.gov</a></li></ul>","<p><a href=""https://nycdoe.campintouch.com/ui/forms/application/camper/App""  target=""_blank"" rel=""noopener noreferrer"">Apply online</a> by Wednesday, <strong>April 24</strong>.</p><ul><li>Students entering grades 1-9 in September 2024 are selected via lottery.</li><li>Applications for students entering grades 10-12 include a teacher reference form. Students are selected by a review committee.</li><li>For questions, contact <a href=""mailto:STEMMattersNYC@schools.nyc.gov""  target=""_blank"" rel=""noopener noreferrer"">STEMMattersNYC@schools.nyc.gov</a></li></ul>",Apply now,https://nycdoe.campintouch.com/ui/forms/application/camper/App,NULL,NULL,NULL,NULL,NULL,NULL,NULL,NULL,"<ul><li>Visit the <a href=""https://spep.libguides.com/STEMprograms""  target=""_blank"" rel=""noopener noreferrer"">STEM Matters NYC website</a> for more information</li></ul>",NULL,"<p><strong>Learn more online</strong></p><p>Visit the <a href=""https://spep.libguides.com/STEMprograms""  target=""_blank"" rel=""noopener noreferrer"">STEM Matters NYC website</a> for more information.</p>",NULL,NULL,NULL,04/06/2024
