unique_id_number,program_code,language,program_name,program_acronym,page_type,program_category,government_agency,population_served,age_group,plain_language_program_name,program_description,brief_excerpt,heads_up,plain_language_eligibility,how_to_apply_summary,how_to_apply_or_enroll_online,apply_online_call_to_action,url_of_online_application,how_to_apply_or_enroll_by_mail,apply_by_mail_call_to_action,url_of_pdf_application_forms,how_to_apply_or_enroll_in_person,apply_in_person_call_to_action,office_locations_url,how_to_apply_or_enroll_by_phone,required_documents_summary,get_help_summary,get_help_in_person,get_help_online,get_help_by_email,get_help_by_calling_other_than_311,get_help_by_calling_311,updated_at
P077en,N/A,English,Cornerstone Programs,NULL,Program,Enrichment,NYC Department of Youth & Community Development (DYCD),"Children (0-13),Families,NYCHA residents,Students,Youth (10+)","Caregiver,Grade-Schooler,Pre-Teen,Teen,Young Adult",Learning and support programs for kids and adults,"<p>Cornerstone Programs offer NYCHA residents opportunities for fun, learning, and support. Programs are located at 99 NYCHA Community Centers throughout the five boroughs.</p>",<p>Year-round programs for youth and adults hosted at public housing community centers.</p>,<ul><li>Programs are free and available to young people and adults.</li><li>Typical programs for youth and adults include:<ul><li>General Education Diploma (GED) and English for Speakers of Other Languages (ESOL) classes</li><li>High school and college prep</li><li>Creative and performance arts </li><li>Workforce development and referrals </li><li>Family relationship workshops</li><li>Cultural and recreational activities</li><li>Healthy living workshops </li><li>Parenting skills</li><li>Computer access and training</li><li>Tenant education and advocacy</li></ul></li><li>Enrollment for summer programs is every April.</li><li>Enrollment for school-year programs for elementary-age youth is between August and September.</li></ul>,<p>Cornerstone Programs are available to NYCHA residents who are Kindergarten-age or older.</p>,"<p>You can use Discover DYCD to find programs in your area and apply. To get started:</p><ol><li>Go to the <a href=""https://discoverdycd.dycdconnect.nyc/programme-public""  target=""_blank"" rel=""noopener noreferrer"">Discover DYCD website</a>.</li><li>Select ""Community Services"" and click ""Search"".</li><li>Type ""Cornerstone"" into the ""Keyword Search"" box.</li><li>Find programs in your area by entering your zip code, neighborhood, or borough, and clicking ""Search"".</li></ol>","<p>You can use Discover DYCD to find programs in your area. To get started:</p><ol><li>Go to the <a href=""https://discoverdycd.dycdconnect.nyc/programme-public""  target=""_blank"" rel=""noopener noreferrer"">Discover DYCD website</a>.</li><li>Select ""Community Services"" and click ""Search"".</li><li>Type ""Cornerstone"" into the ""Keyword Search"" box.</li><li>Find programs in your area by entering your zip code, neighborhood, or borough, and clicking ""Search"".</li></ol>",Search for a program,https://discoverdycd.dycdconnect.nyc,NULL,NULL,NULL,NULL,NULL,NULL,NULL,NULL,"<ul><li>Call DYCD Community Connect at <a href=""tel: 800-246-4646""  target=""_blank"" rel=""noopener noreferrer"">800-246-4646</a> if you have questions about Cornerstone programs.</li><li>Visit the <a href=""http://www1.nyc.gov/site/dycd/services/after-school/cornerstone.page""  target=""_blank"" rel=""noopener noreferrer"">Cornerstone Programs website</a> for more information.</li></ul>",NULL,"<p><strong>Visit the website</strong></p><p>Visit the <a href=""http://www1.nyc.gov/site/dycd/services/after-school/cornerstone.page""  target=""_blank"" rel=""noopener noreferrer"">Cornerstone Programs website</a> for more information.</p>",NULL,"<p><strong>Call Community Connect</strong></p><p>Call DYCD Community Connect at <a href=""tel:800-246-4646""  target=""_blank"" rel=""noopener noreferrer"">800-246-4646</a> if you have questions about Cornerstone programs.</p>",NULL,05/12/2022
P081en,N/A,English,The Early Intervention Program,EIP,Service,Health,NYC Department of Health & Mental Hygiene (DOHMH),"Children (0-13),Families,People with disabilities,Pregnant & new parents","Baby,Toddler",Help for infants and toddlers with disabilities,"<p>The Early Intervention Program helps young children (birth to 3 years) who have learning disabilities and developmental delays (not learning, playing, growing, talking, or walking like other children their age). The program works with families to set meaningful goals for the child and create a service plan to help the child and family meet those goals.</p>",<p>Early Intervention is a voluntary program for infants and toddlers with disabilities and developmental delays with support for families.</p>,"<ul><li>EIP is available to all families in New York City regardless of income or immigration status.</li><li>There is no cost to families. Your health insurance, including Medicaid, may be used to pay for Early Intervention services, at no direct cost to you or impact on health benefits.</li><li>If the child is 2 years and 11 months or older, you can call 311 to find out if your child can be referred to the program.</li><li>Children may leave the program at any time, but around the time a child turns two, families and their EIP team will start working on a plan for the familys next steps after leaving our program.</li><li>Once the child turns three years old, they may be eligible for preschool special education services provided by the <a href=""https://www.schools.nyc.gov/learning/special-education/help/committees-on-special-education""  target=""_blank"" rel=""noopener noreferrer"">Committee on Preschool Special Education</a> through the Department of Education.</li><li>If your child is not eligible, and is younger than three, you can enroll them in <a href=""https://www1.nyc.gov/site/doh/health/health-topics/early-intervention-developmental-monitoring.page""  target=""_blank"" rel=""noopener noreferrer"">Early Intervention Developmental Monitoring</a>. This free monitoring program will show you if your child is meeting the goals that are expected for their age. It is available for any family who thinks their child is at risk of having a developmental delay.</li></ul>",<p>To be eligible for EIP your child must:</p><ul><li>Live in New York City.</li><li>Be three years old or younger.</li><li>Be evaluated. Program staff will help you choose an evaluating agency.</li></ul>,"<p>Anyone can refer a child up to age three for EIP. To refer a child, you can:</p><ul><li>Call <a href=""tel:311""  target=""_blank"" rel=""noopener noreferrer"">311</a> and say that you want to refer a child to EIP</li><li>Fill out a <a href=""http://www1.nyc.gov/assets/doh/downloads/pdf/earlyint/ei-referral-form.pdf""  target=""_blank"" rel=""noopener noreferrer"">referral form</a> and fax it to your EIP regional office (listed on the form)</li><li>Call the Regional Office in the borough where your child lives and say you want to refer a child to EIP<ul><li>Bronx: <a href=""tel:718-838-6887""  target=""_blank"" rel=""noopener noreferrer"">718-838-6887</a></li><li>Brooklyn: <a href=""tel:718-722-3310 ""  target=""_blank"" rel=""noopener noreferrer"">718-722-3310 </a>(main) / <a href=""tel:718-722-7824""  target=""_blank"" rel=""noopener noreferrer"">718-722-7824</a> (referrals)</li><li>Manhattan: <a href=""tel:212-436-0900""  target=""_blank"" rel=""noopener noreferrer"">212-436-0900</a></li><li>Queens: <a href=""tel:718-553-3954""  target=""_blank"" rel=""noopener noreferrer"">718-553-3954</a></li><li>Staten Island: <a href=""tel:718-568-2300""  target=""_blank"" rel=""noopener noreferrer"">718-568-2300</a></li></ul></li></ul>",NULL,NULL,NULL,NULL,NULL,NULL,NULL,NULL,NULL,NULL,NULL,"<ul><li>Call <a href=""tel:311""  target=""_blank"" rel=""noopener noreferrer"">311</a> and ask for information on the Early Intervention Program.</li><li>Visit the <a href=""https://www1.nyc.gov/site/doh/health/health-topics/early-intervention.page?utm_source=Google_Search&utm_medium=English&utm_campaign=Early_Intervention_FY20""  target=""_blank"" rel=""noopener noreferrer"">Early Intervention program website</a> for more information.</li><li>Text EI to <a href=""sms:877877""  target=""_blank"" rel=""noopener noreferrer"">877877</a> or ""TEMPRANA"" for Spanish (""TEMPRANA"" en Espanol) to sign up for Text to Families</li><li>Learn about <a href=""https://growingupnyc.cityofnewyork.us/age/2-months/#section-milestones""  target=""_blank"" rel=""noopener noreferrer"">milestones</a> on Growing Up NYC to help you understand your baby's development, and act early if you have concerns. </li></ul><p>The Office of Consumer Affairs helps families and community partners by providing additional information and addressing concerns about Early Intervention services.</p><p>Contact the Office of Consumer Affairs by emailing <a href=""mailto:EIConsumerAffairs@health.nyc.gov"" >EIConsumerAffairs@health.nyc.gov</a>.</p>",NULL,"<p><strong>Get help online</strong></p><p>Learn about <a href=""https://growingupnyc.cityofnewyork.us/age/2-months/#section-milestones""  target=""_blank"" rel=""noopener noreferrer"">milestones</a> on Growing Up NYC to help you understand your baby's development and act early if you have concerns </p>","<p>The Office of Consumer Affairs helps families and community partners by providing additional information and addressing concerns about Early Intervention services.</p><p>Contact the Office of Consumer Affairs by emailing <a href=""mailto:EIConsumerAffairs@health.nyc.gov"" >EIConsumerAffairs@health.nyc.gov</a>.</p>","<p>You can call a Regional Office in your borough:</p><ul><li>Bronx: <a href=""tel:718-838-6887""  target=""_blank"" rel=""noopener noreferrer"">718-838-6887</a></li><li>Brooklyn: <a href=""tel:718-722-3310 ""  target=""_blank"" rel=""noopener noreferrer"">718-722-3310 </a>(main) / <a href=""tel:718-722-7824""  target=""_blank"" rel=""noopener noreferrer"">718-722-7824</a> (referrals)</li><li>Manhattan: <a href=""tel:212-436-0900""  target=""_blank"" rel=""noopener noreferrer"">212-436-0900</a></li><li>Queens: <a href=""tel:718-553-3954""  target=""_blank"" rel=""noopener noreferrer"">718-553-3954</a></li><li>Staten Island: <a href=""tel:718-568-2300""  target=""_blank"" rel=""noopener noreferrer"">718-568-2300</a></li></ul>","<p><strong>Call 311 </strong></p><p>For concerns about a child's plan or services, ask for an Assistant Director at the EI Regional Office in the borough where the child lives.</p>",05/12/2022
P082en,S2R037,English,Home Care Services Program,HCSP,Service,Health,NYC Human Resources Administration (HRA),"People with disabilities,Older Adults",Caregiver,Long-term care at home,"<p>You can get care at home instead of moving into a nursing home. Different types of care include a home nurse, house cleaning, physical therapy, and more depending on your needs.</p>",<p>Seniors and people with disabilities can receive health care in their home.</p>,<ul><li>Services are available for children and adults.</li><li>Emergency home care is also available.</li></ul>,"<p>Home care programs have different eligibility requirements, but they all require that you must be eligible for <a href=""https://access.nyc.gov/programs/medicaid/""  target=""_blank"" rel=""noopener noreferrer"">Medicaid</a>.</p>","<p>How you apply for home care programs depends on your needs. Call the HRA Office of Special Services at <a href=""tel:718-557-1399"" >718-557-1399</a> or visit a <a href=""https://www.nyc.gov/assets/hra/downloads/pdf/HCSP-3037-CASA-List-of-Borough-Offices-1-16-2020.pdf""  target=""_blank"" rel=""noopener noreferrer"">Home Care CASA office</a> to find out how to apply to a program right for you and your family.</p>",NULL,NULL,NULL,NULL,NULL,NULL,"<p>How you apply for home care programs depends on your needs. Visit a <a href=""https://www.nyc.gov/assets/hra/downloads/pdf/HCSP-3037-CASA-List-of-Borough-Offices-1-16-2020.pdf""  target=""_blank"" rel=""noopener noreferrer"">Home Care CASA office</a> to find out how to apply to a program right for you and your family.</p>",Find a location,https://www.nyc.gov/assets/hra/downloads/pdf/HCSP-3037-CASA-List-of-Borough-Offices-1-16-2020.pdf,"<p>Call <a href=""tel:718-557-1399"" >718-557-1399</a> to learn how to apply.</p>",NULL,"<ul><li>Visit the <a href=""http://www1.nyc.gov/site/hra/help/long-term-care.page""  target=""_blank"" rel=""noopener noreferrer"">Home Care website</a> to find out more about the different home care options.</li></ul>",NULL,"<p><strong>Visit the website</strong></p><p>Visit the <a href=""http://www1.nyc.gov/site/hra/help/long-term-care.page""  target=""_blank"" rel=""noopener noreferrer"">Home Care website</a> to find out more about the different home care options.</p>",NULL,NULL,NULL,10/02/2024
P083en,S2R035,English,NYCHA Public Housing,NULL,Program,Housing,NYC Housing Authority (NYCHA),NULL,Everyone,Affordable public housing,<p>People with low and moderate income can rent affordable housing through the New York City Housing Authority (NYCHA). </p>,<p>Affordable housing for low-and moderate-income New Yorkers.</p>,"<ul><li>Rent is based on your family's income. Most buildings have electricity and gas included in the rent.</li><li>You do not need to be a citizen to apply. However, at least one person who lives with you must be a citizen or have legal immigration status.</li><li>Accessible apartments are available for people with disabilities. Some apartments have been modified and are available for persons with mobility impairments. Other reasonable accommodations can be made as well.</li><li>Affordable housing options are also available through <a href=""https://www1.nyc.gov/site/hpd/services-and-information/housing-connect-rentals.page""  target=""_blank"" rel=""noopener noreferrer"">NYC Housing Connect</a> and <a href=""http://www.nychdc.com/pages/Now-Renting.html""  target=""_blank"" rel=""noopener noreferrer"">NYC Housing Development Corporation</a>.</li><li>NYCHA has Senior and Community Centers, and programs that help residents find work and learn how to manage money and finances.</li></ul>","<p>To be eligible for public housing, you should be able to answer <strong>yes</strong> to these questions.</p><ol><li>Is at least one person in your household a US citizen? If not, does at least one person have legal immigration status (e.g. permanent resident, refugee, or asylum status)?</li><li>Are you 18 or older, or are you an emancipated minor?</li><li>If you are applying with someone (a spouse or domestic partner), are they 18 years or older, or are  they an emancipated minor?</li><li>If you are applying for senior public housing, are you and everyone else who will live with you 62 years old or older?</li><li>Do you meet NYCHA's definition of family, which includes:<ul><li>two or more people related by blood, marriage, domestic partnership, adoption, guardianship, or court-awarded custody?</li><li>a single person?</li></ul></li><li>Is your family's income at or below the <a href=""https://www1.nyc.gov/site/nycha/eligibility/eligibility.page""  target=""_blank"" rel=""noopener noreferrer"">income limits</a>?</li></ol><table><tr><td><p><strong>Family size</strong></p></td><td><p><strong>Income in a year</strong></p></td></tr><tr><td><p>1</p></td><td><p>$87,100</p></td></tr><tr><td><p>2</p></td><td><p>$99,550</p></td></tr><tr><td><p>3</p></td><td><p>$111,950</p></td></tr><tr><td><p>4</p></td><td><p>$124,400</p></td></tr><tr><td><p>5</p></td><td><p>$134,350</p></td></tr><tr><td><p>6</p></td><td><p>$144,300</p></td></tr><tr><td><p>7</p></td><td><p>$154,250</p></td></tr><tr><td><p>8</p></td><td><p>$164,200</p></td></tr></table><p><br/></p>","<ul><li>Apply for public housing on the <a href=""https://selfserve.nycha.info/nycha/app/eservice/enu?SWECmd=GotoView&SWEView=NYCHA+OUI+Notice+Instruction+View""  target=""_blank"" rel=""noopener noreferrer"">NYCHA website</a>. </li><li>Paper applications are available at the <a href=""http://www1.nyc.gov/site/nycha/about/contact.page"" >NYCHA Customer Contact Center</a> or by calling <a href=""tel:718-707-7771""  target=""_blank"" rel=""noopener noreferrer"">718-707-7771</a>.</li><li>After you apply, you will be given a priority code based on your information and placed on the waiting list for an eligibility interview.</li><li>You can check your case status at anytime by registering and then logging into the <a href=""https://selfserve.nycha.info/nycha/app/eservice/enu?SWECmd=Start&""  target=""_blank"" rel=""noopener noreferrer"">NYCHA self-service portal</a>.</li></ul>","<p>To apply for public housing, you must submit an application on the <a href=""https://selfserve.nycha.info/nycha/app/eservice/enu?SWECmd=GotoView&SWEView=NYCHA+OUI+Notice+Instruction+View""  target=""_blank"" rel=""noopener noreferrer"">NYCHA website</a>.</p><p>After you apply, you will be assigned a case number and put on a waiting list for an eligibility interview. Use the <a href=""https://selfserve.nycha.info/nycha/app/eservice/enu?SWECmd=Start&""  target=""_blank"" rel=""noopener noreferrer"">self-service portal</a> to check your status at any time. You'll need to register and log in.</p>",Apply online,https://selfserve.nycha.info/nycha/app/eservice/enu?SWECmd=GotoView&SWEView=NYCHA+OUI+Notice+Instruction+View,"<p>Applicants are encouraged to apply online. However, paper applications are available by mail. Call NYCHAs Customer Contact Center (CCC) at <a href=""tel:718-707-7771""  target=""_blank"" rel=""noopener noreferrer"">718-707-7771</a> to request a paper application.</p>",NULL,NULL,NULL,NULL,NULL,NULL,"<p>You do not need to submit any documents to apply for public housing. If you get an interview, you will need to bring the following original documents with you.</p><ul><li>Your marriage or domestic partner certificate (if applicable)</li><li>Birth certificates of everyone who will live with you</li><li>Social security cards of everyone who will live with you</li><li>Proof of your immigration status (if applicable)</li><li>Proof of where you currently live, such as a recent utility bill</li><li>Rent receipts for the last six months and your lease (if you have one)</li><li>Your last gas and electric bill</li><li>Proof of your income (if any), such as an award letter, pay stubs, or SNAP letter</li><li>Documents showing your assets, such as a bank statement</li></ul>","<ul><li>Visit the <a href=""http://www1.nyc.gov/site/nycha/index.page""  target=""_blank"" rel=""noopener noreferrer"">NYCHA website</a> for more information.</li><li>Call NYCHAs Customer Contact Center (CCC) at <a href=""tel:718-707-7771""  target=""_blank"" rel=""noopener noreferrer"">718-707-7771</a> if you have questions about public housing.</li></ul>",NULL,"<p><strong>Visit the website</strong></p><p>Visit the <a href=""http://www1.nyc.gov/site/nycha/index.page""  target=""_blank"" rel=""noopener noreferrer"">NYCHA website</a> for more information.</p>",NULL,"<p><strong>Call NYCHA</strong></p><p>Call NYCHAs Customer Contact Center (CCC) at <a href=""tel:718-707-7771""  target=""_blank"" rel=""noopener noreferrer"">718-707-7771</a> if you have questions about public housing.</p>",<p><strong>Call 311</strong></p><p>Ask for Public Housing.</p>,10/01/2024
P084en,N/A,English,School-Age and Early Childhood Family and Community Engagement (FACE) Centers,NULL,Service,NULL,NYS Department of Education (NYS DOE); INCLUDEnyc,"All New Yorkers, regardless of immigration status,Families with children,People with disabilities",Everyone,Support for young people with disabilities,<p>School-Age and Early Childhood Family and Community Engagement (FACE) Centers help young New Yorkers with disabilities who are 0 to 21 years old. Help is also available for their families and the professionals who support them. </p>,"<p>Information and resources for young people with disabilities (age 0-21), their families, and their caregivers.</p>","<ul><li>FACE center services are available for free to young people and their parents who live in the five boroughs.</li><li>FACE Centers offer many services including:<ul><li>guidance to help children with disabilities and their parents navigate early childhood.</li><li>teaching special education students to advocate for themselves in school. This includes teaching them how to participate meaningfully in their Individualized Education Program (IEP) meetings.</li><li>teaching parents and special education students about the college admissions process.</li><li>helping youth transition into adult life. This means working with youth to plan for job training, work, higher education, and engaging with the community.</li><li>workshops and activities to help young adults develop social-emotional skills and life skills for independent living.</li></ul></li><li>Parents can also get support through workshops on topics like: <ul><li>understanding IEPs (Individualized Education Programs)</li><li>the special education process</li><li>school placement</li><li>accessing work and public benefits</li><li>parent advocacy</li></ul></li></ul>",<p>All NYC families who care for a child with disabilities are eligible to receive services for free. Trainings are open to everyone.</p>,"<p><strong>Call</strong></p><p>You can speak one-on-one with an expert to get help and information on services. Call or text IncludeNYC's Help Line to schedule an appointment.</p><ul><li>English<ul><li>Call <a href=""tel:212-677-4660""  target=""_blank"" rel=""noopener noreferrer"">212-677-4660</a></li><li>Text 646-693-3175</li></ul></li><li>Spanish<ul><li>Call <a href=""tel:212-677-4668""  target=""_blank"" rel=""noopener noreferrer"">212-677-4668</a></li><li>Text 646-693-3157</li><li>WhatsApp at 212-858-0795</li></ul></li></ul><p><strong>Online</strong></p><p>Request help by <a href=""https://includenyc.org/help-center/help-line/""  target=""_blank"" rel=""noopener noreferrer"">completing the online form</a> on IncludeNYC's website. </p>","<p>Request help by <a href=""https://includenyc.org/help-center/help-line/""  target=""_blank"" rel=""noopener noreferrer"">completing the online form</a> on IncludeNYC's website. </p>",NULL,NULL,NULL,NULL,NULL,NULL,NULL,NULL,"<p>You can speak one-on-one with an expert to get help and information on services. Call or text IncludeNYC's Help Line to schedule an appointment.</p><ul><li>English<ul><li>Call <a href=""tel:212-677-4660""  target=""_blank"" rel=""noopener noreferrer"">212-677-4660</a></li><li>Text 646-693-3175</li></ul></li><li>Spanish<ul><li>Call <a href=""tel:212-677-4668""  target=""_blank"" rel=""noopener noreferrer"">212-677-4668</a></li><li>Text 646-693-3157</li><li>WhatsApp at 212-858-0795</li></ul></li></ul>",NULL,"<p><strong>Visit the IncludeNYC website</strong></p><p>Visit <a href=""https://www.includenyc.org/""  target=""_blank"" rel=""noopener noreferrer"">includenyc.org</a> for more information and services.</p><p><strong>Email IncludeNYC</strong></p><p><a href=""mailto:info@includenyc.org"" >info@includenyc.org</a></p><p><strong>Call the IncludeNYC Help Line</strong></p><p>English: <a href=""tel:212-677-4660""  target=""_blank"" rel=""noopener noreferrer"">212-677-4660</a> </p><p>Spanish: <a href=""tel:212-677-4668""  target=""_blank"" rel=""noopener noreferrer"">212-677-4668</a></p>",NULL,"<p><strong>Visit the IncludeNYC website</strong></p><p>Visit <a href=""https://www.includenyc.org/""  target=""_blank"" rel=""noopener noreferrer"">includenyc.org</a> for more information and services.</p>","<p><strong>Email IncludeNYC</strong></p><p><a href=""mailto:info@includenyc.org"" >info@includenyc.org</a></p>","<p><strong>Call the IncludeNYC Help Line</strong></p><p>English: <a href=""tel:212-677-4660""  target=""_blank"" rel=""noopener noreferrer"">212-677-4660</a> </p><p>Spanish: <a href=""tel:212-677-4668""  target=""_blank"" rel=""noopener noreferrer"">212-677-4668</a></p>",NULL,10/12/2024
