unique_id_number,program_code,language,program_name,program_acronym,page_type,program_category,government_agency,population_served,age_group,plain_language_program_name,program_description,brief_excerpt,heads_up,plain_language_eligibility,how_to_apply_summary,how_to_apply_or_enroll_online,apply_online_call_to_action,url_of_online_application,how_to_apply_or_enroll_by_mail,apply_by_mail_call_to_action,url_of_pdf_application_forms,how_to_apply_or_enroll_in_person,apply_in_person_call_to_action,office_locations_url,how_to_apply_or_enroll_by_phone,required_documents_summary,get_help_summary,get_help_in_person,get_help_online,get_help_by_email,get_help_by_calling_other_than_311,get_help_by_calling_311,updated_at
P001en,S2R001,English,Child and Dependent Care Tax Credit,CDCC,Benefit,Cash & expenses,NYC Department of Consumer and Worker Protection (DCWP); Internal Revenue Service (IRS),"Families with children,Pregnant & new parents",Everyone,Tax refund if you paid for child and dependent care,"<p>The Child and Dependent Care Tax Credit reimburses up to 50% of costs for caring for a child or adult dependent. On your 2023 tax return, you can claim up to $3,000 for the cost of care for one qualifying person and $6,000 for care for two or more qualifying persons.</p>",<p>Get money back if you paid for childcare or adult dependent care while working or looking for work.</p>,"<ul><li>File your 2023 tax return by <strong>April 15, 2024</strong> to claim this credit.</li><li>You qualify if you paid for the care of a qualifying child or children while you worked or looked for work. This includes costs for a day care center or a babysitter.</li></ul>","<p>To be eligible for the Child and Dependent Care Tax Credit, you should be able to answer <strong>yes</strong> to these questions:</p><ol><li>Did you pay someone to care for your dependent so that you (and your spouse, if filing a joint return) could work or look for work? Qualifying dependents are:<ul><li>a child under age 13 at the time of care; </li><li>a spouse or adult dependent who cannot physically or mentally care for themselves.</li></ul></li><li>Did the dependent live with you for more than half of 2023?</li><li>Did you (and your spouse if you file taxes jointly) earn income? These can be from wages, salaries, tips, other taxable employee money, or earnings from self-employment.</li><li>If you are married, do both you and your spouse work outside of the home?<ul><li>Or, do one of you work outside of the home while the other is a full-time student, has a disability, or is looking for work?</li></ul></li></ol>","<p>Include <a href=""https://www.irs.gov/pub/irs-pdf/f2441.pdf""  target=""_blank"" rel=""noopener noreferrer"">Form 2441</a> when you file your tax return.</p><p><a href=""https://www1.nyc.gov/site/dca/consumers/file-your-taxes.page""  target=""_blank"" rel=""noopener noreferrer"">Get free tax filing help</a> if your family earned $85,000 or less or if you're a single filer who earned $59,000 or less in 2023. IRS-certified VITA/TCE volunteer preparers can help you file online, in person, or after you drop off your documents.</p>","<p><a href=""https://www1.nyc.gov/site/dca/consumers/file-your-taxes.page""  target=""_blank"" rel=""noopener noreferrer"">Get free tax filing help</a> if your family earned $85,000 or less or if you're a single filer who earned $59,000 or less in 2023. IRS-certified VITA/TCE volunteer preparers can help you file online, in person, or after you drop off your documents.</p>",File online,http://www1.nyc.gov/site/dca/consumers/file-your-taxes.page,"<p>You will need these forms when filing your tax return:</p><ul><li>Child and Dependent Care Expenses form: <a href=""https://www.irs.gov/pub/irs-pdf/f2441.pdf""  target=""_blank"" rel=""noopener noreferrer"">Form 2441</a>.</li><li>U.S. Individual Income Tax Return: <a href=""https://www.irs.gov/pub/irs-pdf/f1040.pdf""  target=""_blank"" rel=""noopener noreferrer"">Form 1040</a>or U.S. Nonresident Income Tax Return: <a href=""https://www.irs.gov/forms-pubs/about-form-1040-nr""  target=""_blank"" rel=""noopener noreferrer"">Form 1040NR</a>.</li></ul>",NULL,NULL,"<p><a href=""https://www1.nyc.gov/site/dca/consumers/file-your-taxes.page""  target=""_blank"" rel=""noopener noreferrer"">Get free tax filing help</a> if your family earned $85,000 or less or if you're a single filer who earned $59,000 or less in 2023. IRS-certified VITA/TCE volunteer preparers can help you file online, in person, or after you drop off your documents.</p>",Find a tax prep location,https://a866-dcwpwb.nyc.gov/ftps_map/,NULL,"<p>To claim the credit, you will need to prove the following for all people listed on your tax return:</p><ul><li>Identity and age: such as photo ID, drivers license, IDNYC, passport, or naturalization certificate.</li><li>Citizenship or immigration status: such as your birth certificate or a U.S. passport.</li><li>Your earned and unearned income (if any): such as a recent pay stub or unemployment benefits statement, pension correspondence, Supplemental Security Income (SSI), or Social Security Disability Insurance (SSDI).</li><li>Dependent care cost: Amount of money you paid for your child or dependent's care.</li></ul>","<ul><li><a href=""https://www1.nyc.gov/site/dca/consumers/get-tax-credit-information.page""  target=""_blank"" rel=""noopener noreferrer"">Learn more about tax credits</a> you can claim.</li><li>Call <a href=""tel:800-906-9887""  target=""_blank"" rel=""noopener noreferrer"">800-906-9887</a> to find the nearest Volunteer Income Tax Assistance (VITA) or Tax Counseling for the Elderly (TCE).</li></ul>",NULL,"<p><strong>More information</strong></p><p><a href=""https://www1.nyc.gov/site/dca/consumers/get-tax-credit-information.page""  target=""_blank"" rel=""noopener noreferrer"">Learn more about tax credits</a> you can claim.</p>",NULL,"<p><strong>Find a VITA or TCE location</strong> </p><p>Call <a href=""tel:800-906-9887""  target=""_blank"" rel=""noopener noreferrer"">800-906-9887</a> to find the nearest Volunteer Income Tax Assistance (VITA) or Tax Counseling for the Elderly (TCE).</p>",NULL,10/12/2024
P003en,S2R003,English,Infant and Toddler Programs,NULL,Program,Child Care,NYC Public Schools,"Families with children,Pregnant & new parents","Baby,Toddler",Free or low-cost child care for children six weeks to two years old,<p>Infant and Toddler programs provide free or low-cost child care and education for children six weeks to two years old. There are hundreds of programs in New York City that offer safe and positive learning environments for children.</p>,<p>Early child care and education services for up to 10 hours a day.</p>,"<ul><li><span>Child care options include: </span><ul><li><strong>Extended Day & Year (EDY) Infant and Toddler programs</strong><br/><ul><li>For children aged six weeks to two years.</li><li>Takes place in centers or homes for up to 10 hours a day.</li><li>Families will need to pay some of the cost of child care if they do not get Cash Assistance, are not in foster care, or are not homeless.</li></ul></li><li><strong>Early Head Start programs</strong> <ul><li>Provide services for children aged six weeks to three-years-old (who are not yet age-eligible for 3K).</li><li>Services for at least eight hours a day.</li></ul></li></ul></li><li>If you qualify and there is a seat available, your child can join a program anytime during the year.</li></ul>","<p><strong>Extended Day & Year (EDY) Infant/Toddler programs</strong></p><p>For EDY programs, children must have legal immigration status. Children are eligible for care regardless of the parents legal immigration status.</p><p>You must have at least one of these approved reasons for care:</p><ul><li>You work 10+ hours per week</li><li>You are in an educational or vocational training program</li><li>You are starting to look for work or have been looking for work for up to 6 months. This includes looking for work while receiving unemployment</li><li>You live in temporary housing</li><li>You are attending services for domestic violence</li><li>You are receiving treatment for substance abuse</li><li>You may qualify if your household income is at or below these amounts:</li></ul><table><tr><td><p><strong>Family size</strong></p></td><td><p><strong>Monthly income</strong></p></td><td><p><strong>Yearly income</strong></p></td></tr><tr><td><p>2</p></td><td><p>$6,156</p></td><td><p>$73,869.56</p></td></tr><tr><td><p>3</p></td><td><p>$7,604</p></td><td><p>$91,250.63</p></td></tr><tr><td><p>4</p></td><td><p>$9,053</p></td><td><p>$108,631.70</p></td></tr><tr><td><p>5</p></td><td><p>$10,501</p></td><td><p>$126,012.77</p></td></tr><tr><td><p>6</p></td><td><p>$11,949</p></td><td><p>$143,393.84</p></td></tr><tr><td><p>7</p></td><td><p>$12,221</p></td><td><p>$146,652.80</p></td></tr><tr><td><p>8</p></td><td><p>$12,493</p></td><td><p>$149,911.75</p></td></tr><tr><td><p>9</p></td><td><p>$12,764</p></td><td><p>$153,170.70</p></td></tr><tr><td><p>10</p></td><td><p>$13,036</p></td><td><p>$156,429.65</p></td></tr><tr><td><p>11</p></td><td><p>$13,307</p></td><td><p>$159.688.60</p></td></tr><tr><td><p>12</p></td><td><p>$13,579</p></td><td><p>$162,947.55</p></td></tr><tr><td><p>13</p></td><td><p>$13,851</p></td><td><p>$166,206.50</p></td></tr><tr><td><p>14</p></td><td><p>$14,122</p></td><td><p>$169,465.45</p></td></tr><tr><td><p>15</p></td><td><p>$14,394</p></td><td><p>$172,724.40</p></td></tr></table><p><strong>Early Head Start programs</strong></p><p>Legal immigration status is not a requirement for children or parents in Early Head Start programs.</p><p>The best way to find out if your family is eligible for Early Head Start is to contact a program directly. Your family may qualify for Early Head Start if at least one of these categories applies to you:</p><ul><li>You live in temporary housing</li><li>You receive HRA Cash Assistance</li><li>You receive SSI (Supplemental Security Insurance)</li><li>You receive SNAP benefits</li><li>You are enrolling a child who is in foster care</li><li>You may also qualify if your household income is at or below these amounts:</li></ul><table><tr><td><p><strong>Family size</strong></p></td><td><p><strong>Yearly income</strong></p></td></tr><tr><td><p>1</p></td><td><p>$14,580</p></td></tr><tr><td><p>2</p></td><td><p>$19,720</p></td></tr><tr><td><p>3</p></td><td><p>$24,860</p></td></tr><tr><td><p>4</p></td><td><p>$30,000</p></td></tr><tr><td><p>5</p></td><td><p>$35,140</p></td></tr><tr><td><p>6</p></td><td><p>$40,280</p></td></tr><tr><td><p>7</p></td><td><p>$45,420</p></td></tr><tr><td><p>8</p></td><td><p>$50,560</p></td></tr><tr><td><p>For each additional person, add:</p></td><td><p>$5,140</p></td></tr></table><p><br/></p>","<p>Here are your options to apply:</p><ul><li>Apply online using the <a href=""https://mycity.nyc.gov/s/childcarelanding?language=en_US&LanguageCode=en_US"" >MyCity app</a>.</li><li>Apply by mail - <a href=""https://www1.nyc.gov/site/acs/early-care/forms.page"" >Download the application in your language.</a> Complete and mail it to:<br/>NYC DOE Family Welcome Center<br/>333 7th Ave<br/>12th floor<br/>New York NY 10001</li><li>Apply in person <ol><li>Find a program on <a href=""https://www.myschools.nyc/en/schools/3k/""  target=""_blank"" rel=""noopener noreferrer"">MySchools.</a><ul><li>Click More Filters and check any of the options under EarlyLearn.</li><li>Then, type in your home address to find a program near you.</li></ul></li><li>Visit a program. Staff will help you complete the application.</li></ol></li></ul><p>If you already get HRA benefits, apply at your assigned <a href=""http://www.nyc.gov/html/hra/html/services/job_centers.shtml"" >HRA Benefits Access Center</a> instead.</p>","<p>Apply using the <a href=""https://mycity.nyc.gov/s/childcarelanding?language=en_US&LanguageCode=en_US"" >MyCity app</a>.</p>",Apply online,https://mycity.nyc.gov/s/childcarelanding?language=en_US&LanguageCode=en_US,"<ol><li><a href=""https://www1.nyc.gov/site/acs/early-care/forms.page"" >Download the application in your language.</a></li><li>Complete and mail it to:<br/>NYC DOE Family Welcome Center<br/>333 7th Ave<br/>12th floor<br/>New York NY 10001</li></ol><p>If you already get HRA benefits, apply at your assigned <a href=""http://www.nyc.gov/html/hra/html/services/job_centers.shtml"" >HRA Benefits Access Center</a> instead.</p>",Download the application,https://www1.nyc.gov/site/acs/early-care/forms.page,"<ol><li>Find a program on <a href=""https://www.myschools.nyc/en/schools/3k/""  target=""_blank"" rel=""noopener noreferrer"">MySchools.</a><ul><li>Click More Filters and check any of the options under EarlyLearn.</li><li>Then, type in your home address to find a program near you.</li></ul></li><li>Visit a program. Staff will help you complete the application.</li></ol><p>If you already get HRA benefits, apply at your assigned <a href=""http://www.nyc.gov/html/hra/html/services/job_centers.shtml""  target=""_blank"" rel=""noopener noreferrer"">HRA Benefits Access Center</a> instead.</p>",Find a program,https://www.myschools.nyc/en/schools/3k/,NULL,NULL,"<ul><li>Get more information about childcare from <a href=""https://www.schools.nyc.gov/enrollment/enroll-grade-by-grade/earlylearn-nyc""  target=""_blank"" rel=""noopener noreferrer"">NYCDOE</a>.</li></ul>",NULL,"<p><strong>Visit the website</strong> </p><p>Get more information about childcare from <a href=""https://www.schools.nyc.gov/enrollment/enroll-grade-by-grade/earlylearn-nyc""  target=""_blank"" rel=""noopener noreferrer"">NYCDOE</a>.</p>",NULL,NULL,NULL,10/12/2024
P004en,S2R004,English,Child Tax Credit,CTC,Benefit,Cash & expenses,NYC Department of Consumer and Worker Protection (DCWP); Internal Revenue Service (IRS),"Families with children,Pregnant & new parents",Everyone,Tax credit for families with children,"<p>When filing taxes for 2023, families can claim this tax credit worth up to $2,000 for each qualifying child under 17 years old.</p>","<p>When filing taxes for 2023, families can claim this tax credit worth up to $2,000 for each qualifying child under 17 years old.</p>","<ul><li>File your 2023 tax return by <strong>April 15, 2024</strong> to claim this credit.</li><li>Your family can be eligible even if you did not earn income or owe any income taxes. However, your child needs to have a Social Security Number.</li><li>The credit does not count as income and will not affect your eligibility for public benefits.</li></ul>","<p>To be eligible for the credit in the 2023 tax year, you should meet these requirements:</p><ol><li>You earned up to $200,000 and up to $400,000 if you are married filing jointly. </li><li>You're claiming a child on your tax return who is:<ul><li>16 or younger</li><li>The child must have a Social Security Number (SSN) or Adoption Tax Identification Number (ATIN). The filer may use an SSN or Individual Taxpayer Identification Number (ITIN).</li><li>Qualifying children must be your son, daughter, stepchild, eligible foster child, brother, sister, stepbrother, stepsister, half-brother, half-sister, or a descendant of one of these (for example, a grandchild, niece or nephew)</li></ul></li><li>Your child or dependent lived with you for over half of the year in the U.S. and you are claiming them as a dependent on your tax return. <ul><li>Your child cannot provide more than half of their own financial support.</li></ul></li></ol>","<p>Complete <a href=""https://www.irs.gov/pub/irs-pdf/f1040.pdf""  target=""_blank"" rel=""noopener noreferrer"">Form 1040</a>. Also complete <a href=""https://www.irs.gov/pub/irs-pdf/f1040s8.pdf""  target=""_blank"" rel=""noopener noreferrer"">Schedule 8812</a> to see how much of the Child Tax Credit you can receive.</p><p><a href=""https://www1.nyc.gov/site/dca/consumers/file-your-taxes.page""  target=""_blank"" rel=""noopener noreferrer"">Get free tax filing help</a> if your family earned $85,000 or less or if you're a single filer who earned $59,000 or less in 2023. IRS-certified VITA/TCE volunteer preparers can help you file online, in person, or after you drop off your documents.</p>","<p><a href=""https://www1.nyc.gov/site/dca/consumers/file-your-taxes.page""  target=""_blank"" rel=""noopener noreferrer"">Get free tax filing help</a> if your family earned $85,000 or less or if you're a single filer who earned $59,000 or less in 2023. IRS-certified VITA/TCE volunteer preparers can help you file online, in person, or after you drop off your documents.</p>",NULL,http://www1.nyc.gov/site/dca/consumers/file-your-taxes.page,NULL,NULL,NULL,"<p>Complete <a href=""https://www.irs.gov/pub/irs-pdf/f1040.pdf""  target=""_blank"" rel=""noopener noreferrer"">Form 1040</a>. Also complete <a href=""https://www.irs.gov/pub/irs-pdf/f1040s8.pdf""  target=""_blank"" rel=""noopener noreferrer"">Schedule 8812</a> to see how much of the Child Tax Credit you can receive.</p><p><a href=""https://www1.nyc.gov/site/dca/consumers/file-your-taxes.page""  target=""_blank"" rel=""noopener noreferrer"">Get free tax filing help</a> if your family earned $85,000 or less or if you're a single filer who earned $59,000 or less in 2023. IRS-certified VITA/TCE volunteer preparers can help you file online, in person, or after you drop off your documents.</p>",Find a tax prep location,https://a866-dcwpwb.nyc.gov/ftps_map/,NULL,"<p><a href=""https://www.nyc.gov/site/dca/consumers/file-your-taxes-documents.page""  target=""_blank"" rel=""noopener noreferrer"">See a list of documents</a> you'll need to file your taxes and claim the CTC.</p>","<ul><li><a href=""https://www1.nyc.gov/site/dca/consumers/get-tax-credit-information.page""  target=""_blank"" rel=""noopener noreferrer"">Learn more about tax credits</a> you can claim.</li><li>Call <a href=""tel:800-906-9887""  target=""_blank"" rel=""noopener noreferrer"">800-906-9887</a> to find the nearest Volunteer Income Tax Assistance (VITA) or Tax Counseling for the Elderly (TCE).</li></ul>",NULL,"<p><strong>More information</strong></p><p><a href=""https://www1.nyc.gov/site/dca/consumers/get-tax-credit-information.page""  target=""_blank"" rel=""noopener noreferrer"">Learn more about tax credits</a> you can claim.</p>",NULL,"<p><strong>Find a VITA or TCE location</strong></p><p>Call <a href=""tel:800-906-9887"" >800-906-9887</a> to find the nearest Volunteer Income Tax Assistance (VITA) or Tax Counseling for the Elderly (TCE).</p>",NULL,10/12/2024
P005en,S2R005,English,Disability Rent Increase Exemption,DRIE,Program,Housing,NYC Department of Finance (DOF),People with disabilities,Caregiver,Rent freeze for people with disabilities,<p>DRIE helps eligible tenants with disabilities stay in affordable housing by freezing their rent. This means tenants can keep paying what they were paying even if the landlord increases the rent. The landlord will get a property tax credit that covers the difference between the new and original rent amount.</p>,<p>A rent freeze program to help eligible New Yorkers stay in their home.</p>,"<ul><li>You need to be receiving a qualifying disability benefit to qualify for DRIE.</li><li>Renew on time to keep paying the same amount of rent in the future as you do now.</li><li>You are not required to file taxes to qualify for DRIE.<br/></li><li>You do not need your landlord's permission to apply.</li><li>The NYC Rent Freeze program also includesthe <a href=""https://access.nyc.gov/programs/senior-citizens-rent-increase-exemption""  target=""_blank"" rel=""noopener noreferrer"">Senior Citizen Rent Increase Exemption (SCRIE)</a> for seniors 62 and older.</li></ul>","<p>To be eligible for DRIE, you should be able to answer ""<strong>yes</strong>"" to all of these questions:</p><ol><li>Are you 18 years old or older?</li><li>Is your name on the lease?</li><li>Is your combined household income $50,000 or less in a year?</li><li>Do you spend more than one-third of your monthly income on rent?</li><li>Do you live in NYC in one of these types of housing?<ul><li>a rent stabilized apartment</li><li>a rent controlled apartment</li><li>a Mitchell-Lama development</li><li>a Limited Dividend development</li><li>a redevelopment company development</li><li>a Housing Development Fund Company (HDFC) Cooperative development</li><li>a Section 213 Cooperative unit</li><li>a rent regulated hotel or single room occupancy unit</li></ul></li><li>Do you have income from the following benefits?<ul><li>Supplemental Security Income (SSI)</li><li>Federal Social Security Disability Insurance (SSDI)</li><li>U.S. Department of Veterans Affairs (VA) disability pension or compensation</li><li>Disability-related Medicaid if you received either SSI or SSDI in the past</li></ul></li></ol>","<p><strong>Online</strong></p><p>If you are applying for DRIE for the first time, you can apply <a href=""https://www1.nyc.gov/site/rentfreeze/tools/nyc-tap.page""  target=""_blank"" rel=""noopener noreferrer"">online</a>.</p><p><a href=""https://www1.nyc.gov/assets/finance/jump/dof-appointments.html""  target=""_blank"" rel=""noopener noreferrer"">Schedule a virtual appointment</a> to apply for DRIE.</p><p><strong>By mail</strong></p><ol><li>Print an <a href=""https://www1.nyc.gov/assets/rentfreeze/downloads/pdf/drie/drie-initial-application-only.pdf""  target=""_blank"" rel=""noopener noreferrer"">initial application</a> and fill it out. You can also pick one up from the DRIE Assistance Center or call <a href=""tel:311""  target=""_blank"" rel=""noopener noreferrer"">311</a> to request an application be mailed to you.</li><li>Mail your completed and signed application along with supporting documents to:<strong><br/>Rent Freeze Program  DRIE</strong><br/>P.O. Box 3179<br/>Union, NJ 07083</li></ol><p><strong>In-person</strong></p><p>Find a <a href=""https://www1.nyc.gov/site/rentfreeze/help/help-temporary-centers.page""  target=""_blank"" rel=""noopener noreferrer"">Department of Finance Assistance Center</a> near you to apply. You may need to schedule an appointment to visit a center.</p><p><strong>By phone</strong></p><ul><li>If you live in a Housing Development Fund Company (HDFC) apartment, call HPD at <a href=""tel:212-863-8494""  target=""_blank"" rel=""noopener noreferrer"">212-863-8494</a> to apply for DRIE.</li></ul>","<p><a href=""https://www1.nyc.gov/site/rentfreeze/tools/nyc-tap.page""  target=""_blank"" rel=""noopener noreferrer"">Complete the online application through the Department of Finance (DOF)</a> if you are applying for DRIE for the first time.</p><p>You can get help applying to DRIE by <a href=""https://www1.nyc.gov/assets/finance/jump/dof-appointments.html""  target=""_blank"" rel=""noopener noreferrer"">scheduling a virtual appointment with DOF</a>. </p>",NULL,NULL,"<ol><li>Print and complete the <a href=""https://www1.nyc.gov/assets/rentfreeze/downloads/pdf/drie/drie-initial-application-only.pdf""  target=""_blank"" rel=""noopener noreferrer"">initial application</a> (or call 311 for an application).</li><li>Mail your completed and signed application along with supporting documents to:<strong> <br/>Rent Freeze Program  DRIE</strong> <br/>P.O. Box 3179 <br/>Union, NJ 07083</li></ol>",NULL,NULL,"<p>Apply at a <a href=""https://www1.nyc.gov/site/rentfreeze/help/help-temporary-centers.page""  target=""_blank"" rel=""noopener noreferrer"">Department of Finance Assistance Center</a>. You may need to schedule an appointment.</p>",Find a center,https://www1.nyc.gov/site/rentfreeze/help/help-temporary-centers.page,NULL,"<p>To apply for DRIE, you will need copies of documents that prove:</p><ul><li>Who you are (and your age)</li><li>Where you live (with rental amount)</li><li>Income<ul><li>This includes your income and the income of all household members who lived in your apartment the year before you submit your application. For example, if you apply in 2023, you will need  income information for 2022.</li></ul></li><li>That you receive a qualifying disability benefit (and award letter)</li></ul>","<ul><li>Visit the <a href=""http://www1.nyc.gov/site/rentfreeze/index.page""  target=""_blank"" rel=""noopener noreferrer"">NYC Rent Freeze Program website</a> to learn more.</li><li><a href=""http://www1.nyc.gov/site/finance/about/contact-by-email/contact-drie.page""  target=""_blank"" rel=""noopener noreferrer"">Request assistance</a> from the Department of Finance.</li><li>Call <a href=""tel:212-639-9675""  target=""_blank"" rel=""noopener noreferrer"">212-639-9675</a> if you have a hard time hearing.</li><li>Call 311 and ask for a DRIE specialist.</li><li>Call <a href=""tel:929-252-7242""  target=""_blank"" rel=""noopener noreferrer"">929-252-7242</a> to get one-on-one help with applying for DRIE from an <a href=""https://www.nyc.gov/site/mayorspeu/index.page""  target=""_blank"" rel=""noopener noreferrer"">NYC Public Engagement Unit</a> Specialist.</li></ul>",NULL,"<p><strong>Learn more online<br/></strong></p><p>Visit the <a href=""http://www1.nyc.gov/site/rentfreeze/index.page""  target=""_blank"" rel=""noopener noreferrer"">NYC Rent Freeze Program website</a> to learn more. </p>","<p><strong>Contact DRIE</strong> </p><p><a href=""http://www1.nyc.gov/site/finance/about/contact-by-email/contact-drie.page""  target=""_blank"" rel=""noopener noreferrer"">Ask for help</a> from the Department of Finance.</p>","<p><strong>Get help with the application</strong></p><p>Call <a href=""tel:929-252-7242""  target=""_blank"" rel=""noopener noreferrer"">929-252-7242</a> to get one-on-one help with applying for DRIE from an <a href=""https://www.nyc.gov/site/mayorspeu/index.page""  target=""_blank"" rel=""noopener noreferrer"">NYC Public Engagement Unit</a> Specialist.</p><p><strong>Call DRIE using TTY</strong> </p><p>Call <a href=""tel:212-639-9675""  target=""_blank"" rel=""noopener noreferrer"">212-639-9675</a> if you have a hard time hearing.</p>",<p><strong>Call 311</strong> </p><p>Ask about DRIE.</p>,10/02/2024
